{
  "schemaVersion": "0.1.0",
  "riskAcknowledgementId": "11111111-1111-4111-8111-111111111111",
  "runtimeBindingDigest": "aaaaaaaaaaaaaaaaaaaaaaaaaaaaaaaaaaaaaaaaaaaaaaaaaaaaaaaaaaaaaaaa",
  "allowedPurposes": [
    "FINDING_EXPLANATION",
    "PR_SUMMARY"
  ],
  "maxAttempts": 1,
  "maxCostMicrousd": 316373,
  "expiresAt": "2026-10-29T01:00:00Z",
  "callsApproved": true
}
